title,year,journal,Topic_1,Topic_2,Topic_3,Topic_4,Topic_5
Generator breast datamart—the novel breast cancer data discovery system for research and monitoring: Preliminary results and future perspectives,2021,Journal of Personalized Medicine,0.8069029204827669,0.02671962823288674,0.023121729284919283,0.02311634030147762,0.1201393816979495
Iterative Development of a Clinical Decision Support Tool to Enhance Naloxone Coprescribing,2025,Applied Clinical Informatics,0.9114161977298639,0.02277541784752307,0.02174708230517387,0.021747506297718468,0.02231379581972057
The PACIFIC ontology for heterogeneous data management in cardiology,2024,Journal of Biomedical Informatics,0.8928267656666392,0.027312122025034004,0.026527974410977033,0.026525892844687066,0.02680724505266271
Identifying Common Disease Trajectories of Progressive Supranuclear Palsy with Electronic Health Records,2025,Movement Disorders Clinical Practice,0.8787187983683648,0.03407036671643621,0.02858405028624537,0.028584170191659198,0.030042614437294515
From Clinical Data Warehouses to Epidemiological Indicators: A Methodology for Real-Time Surveillance,2026,Studies in Health Technology and Informatics,0.8750524280063163,0.04622592782867617,0.02607366875914276,0.026057045917442272,0.026590929488422392
Making a Virtue of Necessity - A Highly Structured Clinical Data Warehouse as the Source of Assured Truth in a Hospital,2023,Studies in Health Technology and Informatics,0.900805177562452,0.024587923045772356,0.024547986866955637,0.024546986874786583,0.02551192565003341
Development and usage of an anesthesia data warehouse: lessons learnt from a 10-year project,2023,Journal of Clinical Monitoring and Computing,0.87568234278607,0.03546127181784863,0.028858489939609457,0.028836706184002452,0.031161189272469518
Homogenization of brain MRI from a clinical data warehouse using contrast-enhanced to non-contrast-enhanced image translation with U-Net derived models,2022,Progress in Biomedical Optics and Imaging - Proceedings of SPIE,0.576957335498101,0.3478493678987829,0.02495353474948879,0.024953927935218674,0.025285833918408693
Automatic de-identification of French electronic health records: a cost-effective approach exploiting distant supervision and deep learning models,2024,BMC Medical Informatics and Decision Making,0.901722264692556,0.028656269964357776,0.02302052906114296,0.023015194949018,0.023585741332925313
INTERPOLAR_MI - A Study Platform Concept for IT-Supported Drug Therapy Safety Research,2025,Studies in Health Technology and Informatics,0.9057284740749832,0.023602581978033343,0.023329167998566307,0.023327100321991482,0.024012675626425655
"Design, Usability, and Acceptability of a Needs-Based, Automated Dashboard to Provide Individualized Patient-Care Data to Pediatric Residents",2022,Applied Clinical Informatics,0.8575733650660408,0.03682679719466029,0.0349790958547569,0.03497330792266861,0.035647433961873455
Hypergraph Based Data Model for Complex Health Data Exploration and Its Implementation in PREDIMED Clinical Data Warehouse,2022,Studies in Health Technology and Informatics,0.9012507428282039,0.024494235797841084,0.024464427994243202,0.024463440612130818,0.02532715276758094
Reconstructing Longitudinal Medication Trajectories from Integrated National Claims and Clinical Data Warehouse Data: An Application in Oncology,2026,Studies in Health Technology and Informatics,0.6724268482167016,0.029635047188807384,0.029661160989689128,0.029657957876155633,0.23861898572864623
Prediction of Postoperative Lung Function in Lung Cancer Patients Using Machine Learning Models,2023,Tuberculosis and Respiratory Diseases,0.8719384448695489,0.03210539584848407,0.03188165817380173,0.031878913941464075,0.032195587166701324
A Model for Multi-Institutional Clinical Data Repository,2023,Studies in Health Technology and Informatics,0.8769114488349553,0.030784549950048153,0.03076152599901159,0.030759336916786173,0.0307831382991987
Implementation of a Data Warehouse in Primary Care: First Analyses with Elderly Patients,2022,Studies in Health Technology and Informatics,0.8653839177223098,0.0334016017662345,0.033421590599348946,0.03341183231089539,0.03438105760121131
Paediatric Personalized Research Network Switzerland (SwissPedHealth): a joint paediatric national data stream,2024,BMJ Open,0.9173538627678398,0.020886012118310565,0.020413228747204835,0.020411123660556856,0.02093577270608801
Utilization of Erythropoietin within the United States Neonatal Intensive Care Units from 2008 to 2017,2021,American Journal of Perinatology,0.03225603947398393,0.03159486004284279,0.03161759633404446,0.03161820413675668,0.8729133000123721
Linking Biomedical Data Warehouse Records with the National Mortality Database in France: Large-scale Matching Algorithm,2022,JMIR Medical Informatics,0.8941866216454207,0.0269631166891236,0.02596964924644458,0.025962891766515908,0.026917720652495314
Government Mandated Consent Dramatically Reduces Pediatric Urologist Opioid Utilization for Outpatient and Minor Emergency Surgeries,2021,Journal of Urology,0.8634075809564219,0.03223076986493689,0.03225454150599795,0.03225168255199442,0.03985542512064882
Insulin Glargine Utilization and Spending Before and After the First Biosimilar Insulin Glargine: A Real-World Data Study,2025,Journal of General Internal Medicine,0.8634298638829542,0.03301671277581102,0.032852477771864466,0.032853481588515976,0.03784746398085449
Evaluation of Patients' Adverse Events during Contact Isolation for Vancomycin-Resistant Enterococci Using a Matched Cohort Study with Propensity Score,2022,JAMA Network Open,0.8825366966000115,0.029280950689283734,0.029260931520270504,0.02926114930037144,0.02966027189006269
Trends in Procedural Closure of the Patent Ductus Arteriosus among Infants Born at 22 to 30 Weeks’ Gestation,2023,Journal of Pediatrics,0.8511809598909348,0.036759381173687634,0.03679702381508166,0.036799525490566885,0.038463109629729146
Time to Progression to Proliferative Diabetic Retinopathy in Patients With Type 2 Diabetes,2025,JAMA Network Open,0.9047704806074043,0.02461876242211132,0.02266876764094284,0.022669688548025403,0.02527230078151614
Development and Validation of a Natural Language Processing Algorithm to Pseudonymize Documents in the Context of a Clinical Data Warehouse,2024,Methods of Information in Medicine,0.8990902146530254,0.025699707645273472,0.025015631740506028,0.024998190557040372,0.02519625540415483
An interactive dashboard for analyzing user interaction patterns in the i2b2 clinical data warehouse,2024,BMC Medical Informatics and Decision Making,0.9015105481375214,0.02461302206199707,0.0245839679333322,0.0245830605519471,0.024709401315202117
Quantifying Variation in Treatment Utilization for Type 2 Diabetes Across Five Major University of California Health Systems,2021,Diabetes Care,0.030967175537680948,0.030718328606169555,0.030600949646419295,0.03060049253314217,0.877113053676588
Building the adult growth hormone deficiency data mart: a Real-World model of AI-driven clinical data extraction in a single Italian center,2026,Journal of Endocrinological Investigation,0.0210057875348106,0.020844753798234042,0.020812146110775427,0.020811752150181814,0.9165255604059981
Automatic motion artefact detection in brain T1-weighted magnetic resonance images from a clinical data warehouse using synthetic data,2024,Medical Image Analysis,0.024621795567305524,0.9016670856996207,0.024557461798422105,0.02455728133815787,0.024596375596493622
Transfer learning from synthetic to routine clinical data for motion artefact detection in brain T1-weighted MRI,2023,Progress in Biomedical Optics and Imaging - Proceedings of SPIE,0.024965546975312454,0.9002908342115519,0.0249027801561344,0.024902579763387334,0.024938258893614035
Digital Health Profile of South Korea: A Cross Sectional Study,2022,International Journal of Environmental Research and Public Health,0.8973247814402429,0.025665972438785396,0.02564912044432483,0.025648694255267328,0.025711431421379584
A process mining approach for clinical guidelines compliance: real-world application in rectal cancer,2023,Frontiers in Oncology,0.8968576122240647,0.02577299395023072,0.025741498145417742,0.025741210084074893,0.025886685596211878
Homelessness and Veteran Status in Relation to Nonfatal and Fatal Opioid Overdose in Massachusetts,2021,Medical Care,0.8538018961624135,0.03648422946301855,0.036487314120510775,0.03648692620106358,0.036739634052993714
Studies of Supraorbital Notch and Foramen Using 3-Dimensional Facial Bone CT Scans,2021,Pain Physician,0.8228121963262958,0.04476605907463192,0.04406883229117834,0.04406868563275789,0.04428422667513601
